reviewer_question,comparison_target,role,verified_evidence,headline_answer,usable_claim,excluded_claim,status,sources,next_action
Are gains only over weak algebraic baselines?,"Direct ANF, ESOP beam/MILP, ABC/BDD exports",primary same-task benchmark,Internal logical baselines: 1770/1770; Exported SSHR/ABC/BDD extension: 1416/1416,"Pareto vs direct ANF 172/1/4, -67.80%; vs ESOP-MILP 167/3/7, -29.84%; vs ABC-XAG 177/0/0, -65.58%",Lower T-count and weighted score on matched logical bit-flip oracle benchmarks.,"No universal CNOT, depth, ancilla, line-count, or hardware-mapped optimality claim.",pass,summary_comparison_evidence_matrix.csv; summary_paired_statistical_evidence.csv,Keep this row aligned with the upstream comparison evidence and claim boundaries.
Is SSHR the whole comparison target?,SSHR-H and SSHR-I CNOT,CNOT-oriented small-function counterpoint,Internal logical baselines: 1770/1770; Exported SSHR/ABC/BDD extension: 1416/1416,"Pareto vs SSHR-H 173/4/0, -41.06%; vs SSHR-I CNOT 173/4/0, -31.89%; SSHR-H four-resource dominance 33/4/140/0","SSHR is an important CNOT-oriented baseline, but the method is not defined by SSHR's parallelotope search space.",Do not claim CNOT dominance over SSHR; SSHR remains a real CNOT counterpoint.,pass,summary_paired_statistical_evidence.csv; summary_multimetric_pairwise_dominance.csv,Keep this row aligned with the upstream comparison evidence and claim boundaries.
Does the advantage survive external logic synthesis?,"ROS-style LUT/garbage-budget, mockturtle XAG, Caterpillar API, CirKit AIG/MC",external logical-toolchain stress test,ROS-style LUT proxy: 309/309 best rows; 927/927 K-sweep rows; 927/927 garbage-proxy rows; 1059/1059 garbage-budget rows; mockturtle KLUT-to-XAG probe: 241/241; Caterpillar XAG API probe: 177/177 best rows; 531/531 strategy rows; CirKit AIG/MC probe: 241/241,"ROS best-K 309/0/0, -84.27%; mockturtle n<=6 166/11/0, -31.50%; Pareto vs Caterpillar API score 177/0/0, -47.94%; CNOT 4/173/0; CirKit n<=6 177/0/0, -62.34%",The score/T-count advantage is not an artifact of comparing only against local hand-written baselines.,"Not a full ROS SAT garbage-management optimizer, reversible-emission, routing, or hardware-mapped comparison.",pass,summary_comparison_evidence_matrix.csv; summary_paired_statistical_evidence.csv; manifest_caterpillar_xag_api_probe.json,Keep this row aligned with the upstream comparison evidence and claim boundaries.
Does it beat published tiny-function optima?,Published STG n=4/5 optimum table,small-function optimum-library counterpoint,Published STG optimum-library counterpoint: 270/270,"Pareto vs STG T-count optimum 0/40/14, +84.26%; vs direct ANF on STG slice 50/4/0, -58.10%","The method improves its own direct logical baselines on the same STG truth-table slice, while public STG optima remain stronger on tiny precomputed representatives.","No claim of beating published STG T-count, T-depth, or qubit optima on n=4/5 spectral representatives.",pass,summary_comparison_evidence_matrix.csv; summary_stg_published_benchmark.csv,Keep this row aligned with the upstream comparison evidence and claim boundaries.
What does RevKit test?,Legacy RevKit exact oracle and RevKit phase/Rz branch,reversible and phase proxy counterpoint,Legacy RevKit CLI exact oracle: 708/708; RevKit phase/Rz branch: 531/531; Learned phase pruning: 7611/7611,"RevKit CLI exact oracle 173/0/4, -67.28%; Affine phase vs RevKit oracle_synth 177/0/0, -65.50%",A real reversible-synthesis portfolio and a verified phase/Rz proxy do not erase the T/score story.,"Not lower auxiliary-line count, routed depth, or final approximate-rotation Clifford+T synthesis.",pass,summary_comparison_evidence_matrix.csv; summary_paired_statistical_evidence.csv,Keep this row aligned with the upstream comparison evidence and claim boundaries.
What part is actually AI/MCTS?,"No-MCTS portfolio, Pareto archive, learned/random controls, fitted-Q Pareto budget control",causal search-control ablation,Search-control audit: 13/13 pass,"Resource over no-MCTS 54/0/123, -1.44%; Pareto over no-MCTS 106/0/71, -4.69%; learned vs random prior 17/8/152, -0.15%; fitted-Q budget 56/0/104 vs Resource, -3.48%",MCTS and Pareto selection add bounded quality gains; fitted-Q reinforcement learning allocates optional Pareto effort with a measured quality-time tradeoff.,Do not state that deep reinforcement learning alone explains the full resource reduction or that the budget policy dominates always-on Pareto score.,pass,summary_search_control_baseline_audit.csv; summary_mcts_budget_policy.csv,Keep this row aligned with the upstream comparison evidence and claim boundaries.
Is the evidence only small-scale?,n=20--64 symbolic runs and n=21--30 complete truth-table bridges,scaling and correctness verification,High-dimensional frontier search: 2088/2088; Complete truth-table bridges: 700/700,"Stage-gated vs all-depth scale 0/4/92, +0.04% score; -25.43% time; ultra n=48,56,64 stress 480/480 plan+circuit verified; Bridge rows verify plan, emitted symbolic circuit, and complete truth table for n=21-30.",The logical emitter and verification harness scale beyond the n<=6 truth-table benchmark slice.,Not exhaustive high-dimensional truth-table benchmarking or global optimality proof.,pass,summary_comparison_evidence_matrix.csv,Keep this row aligned with the upstream comparison evidence and claim boundaries.
Does weighted score hide bad tradeoffs?,"Four-resource dominance, non-dominated pool, and resource-weight sensitivity",non-dominance boundary,12-method n<=6 dominance pool; 177 matched functions; resource-weight sensitivity 13794 pair/profile rows; 13 comparisons; 6 profiles,Pareto-Resource-NMCTS is 170/177 non-dominated; RevKit CLI exact oracle four-resource dominance 3/0/170/4; CirKit AIG/MC four-resource dominance 21/0/156/0; Caterpillar CNOT-only 4/173/0 while paper score is 177/0/0,The method occupies a strong T/score point while preserving visible CNOT/depth/ancilla and coefficient-sensitivity tradeoffs.,Do not turn weighted-score wins into a complete Pareto or hardware-dominance claim.,pass,summary_multimetric_pairwise_dominance.csv; summary_multimetric_nondominated.csv; manifest_resource_weight_sensitivity_audit.json,Keep this row aligned with the upstream comparison evidence and claim boundaries.
