item,audit_status,coverage_status,evidence,supported_claim,excluded_claim,next_action
Local Caterpillar checkout,pass,source available,path=tmp/caterpillar; remote=https://github.com/gmeuli/caterpillar.git; branch=master; commit=4c6f766,The workstation has a provenance-recorded Caterpillar source checkout for a ROS-family source probe.,A source checkout alone is not a reproduced ROS benchmark.,Keep the checkout provenance in the manifest; add a pinned adapter only if it becomes a performance baseline.
README-stated synthesis role,pass,documented role,tmp/caterpillar/README.md tokens=4/4,Caterpillar is relevant because it targets Boolean-function quantum-circuit synthesis with quantum memory management.,This documentation role is not evidence that the paper ran full ROS.,Refresh the source-family note if the local checkout changes.
Core API surface,pass,API present,tmp/caterpillar/include/caterpillar/synthesis/lhrs.hpp tokens=3/3; tmp/caterpillar/include/caterpillar/synthesis/strategies/pebbling_mapping_strategy.hpp tokens=3/3; tmp/caterpillar/include/caterpillar/structures/stg_gate.hpp tokens=3/3; tmp/caterpillar/include/caterpillar/verification/circuit_to_logic_network.hpp tokens=3/3,"The local source exposes logic-network synthesis, single-target gates, pebbling strategies, and circuit-to-logic verification.",Header availability is not a matched benchmark result over the paper's function suite.,Use these APIs for a future standalone adapter before claiming a new executable baseline.
SAT/pebbling implementation surface,pass,solver surface present,tmp/caterpillar/include/caterpillar/solvers/solver_manager.hpp tokens=3/3; tmp/caterpillar/include/caterpillar/solvers/bsat_solver.hpp tokens=3/3; tmp/caterpillar/include/caterpillar/solvers/z3_solver.hpp tokens=3/3,The source contains bounded-pebbling controls and BSAT/Z3-oriented solver hooks relevant to garbage/memory management.,These hooks are not the official ROS SAT garbage-management optimizer used as a reproduced baseline.,Promote this only after a benchmark driver emits matched oracle resources.
CMake build artifacts,pass,partial build present,build_cache=True; build_test_cache=True; test_objects=19; libabcsat=tmp/caterpillar/build-test/lib/abcsat/liblibabcsat.a exists=True,The local CMake probe built core object files and the abcsat support library.,The build artifacts do not include a standalone ROS or Caterpillar benchmark executable.,"If a stable CLI/adapter is added, record its binary path and matched benchmark manifest."
Toy AIG compile/run smoke,pass,local compile smoke,compile_rc=0; run_rc=0; warnings=19; reason=none,A tiny local AIG can be synthesized through Caterpillar's API and converted back for semantic checking on this workstation.,"This is a toy API smoke test, not a published ROS reproduction or performance comparison.",Turn this into a real baseline only by exporting the paper's benchmark functions and recording resources row by row.
Standalone baseline executable,pass,not available,candidate_executables=0; examples_cpp=0; experiments_cpp=0,The audit records why Caterpillar is currently source-family evidence rather than a new performance row.,No standalone Caterpillar/ROS executable baseline is claimed or used in the result tables.,Create a dedicated adapter and manifest before adding Caterpillar to the quantitative leaderboard.
Manuscript and ROS-gap boundary,pass,claim boundary explicit,paper_latex/resource_nmcts_submission_v1.tex tokens=3/3; DELIVERABLE_zh.md tokens=2/2; results/analysis_ros_reproduction_gap_audit.md tokens=2/2,The paper can mention Caterpillar as a stronger implementation-family probe while preserving the full-ROS boundary.,The manuscript must not describe the Caterpillar probe as full ROS SAT garbage management.,Keep this row green after changing ROS or external-toolchain wording.
