item,audit_status,coverage,current_evidence,evidence,supported_claim,excluded_claim
SSHR literature and method boundary,pass,covered,"The manuscript cites SSHR, states that the proposed method does not search parallelotope candidates, and uses SSHR as a CNOT-oriented small-function baseline.",files_missing=none; tokens=5/5; missing_tokens=none,SSHR is a relevant structured baseline for small Boolean-function oracle synthesis.,The proposed method is not an SSHR variant and does not inherit SSHR's CNOT-only objective.
SSHR Table VIII candidate-space anchor,pass,source-anchored,The development repository contains the SSHR candidate-count reference and table runner when the full source tree is present; the upload payload records the boundary without requiring that parent source tree.,"files_missing=none; tokens=4/4; missing_tokens=none; source_tree_available=True; table_viii_counts={3: 49, 4: 257, 5: 1539, 6: 10299, 7: 75905, 8: 609441}; missing_counts=none; missing_tokens=none",The paper can explain why SSHR's search space is a CNOT-oriented parallelotope counterpoint rather than the proposed ANF/FPRM action space.,This audit does not rerun every published SSHR random benchmark table inside the lightweight submission rebuild.
SSHR-H same-task baseline rows,pass,covered,The traditional bit-flip benchmark includes 177 correct SSHR-H rows and the manuscript keeps SSHR-H visible as the best mean-CNOT baseline in the traditional table.,"files_missing=none; tokens=4/4; missing_tokens=none; csv=results/raw_traditional_resource.csv::sshr_h rows=177/177, incorrect=0; json=results/manifest_traditional_resource.json::functions=177",Resource-NMCTS is compared with a same-function SSHR-H implementation on all traditional benchmark functions.,The SSHR-H row is not evidence of CNOT-only dominance by the proposed method.
SSHR-I CNOT/T extension rows,pass,partial,The external n<=6 extension includes SSHR-I CNOT-objective and T-objective rows for the same 177 functions with correctness checks and explicit timeout metadata.,"files_missing=none; tokens=4/4; missing_tokens=none; csv=results/raw_external_traditional_resource_n6.csv::external_sshr_i_cnot rows=177/177, incorrect=0; results/raw_external_traditional_resource_n6.csv::external_sshr_i_t rows=177/177, incorrect=0; json=results/manifest_external_traditional_resource_n6.json::functions=177; results/manifest_external_traditional_resource_n6.json::max_ilp_n=6; results/manifest_external_traditional_resource_n6.json::timeout=10.0",The manuscript can use SSHR-I as a time-limited CNOT/T-oriented counterpoint on the matched traditional slice.,The n<=6 extension is not an exact certificate for all SSHR-I random-paper settings.
n<=4 exact/pilot SSHR-I cross-check,pass,covered,"The n<=4 external pilot records 72 functions and 216 SSHR-H/SSHR-I rows, and exact small-slice analyses include SSHR-I references as counterpoints.","files_missing=none; tokens=4/4; missing_tokens=none; csv=results/raw_external_traditional_resource_n4.csv::external_sshr_i_cnot rows=72/72, incorrect=0; results/raw_external_traditional_resource_n4.csv::external_sshr_i_t rows=72/72, incorrect=0; json=results/manifest_external_traditional_resource_n4.json::functions=72; results/manifest_external_traditional_resource_n4.json::rows=216; results/manifest_external_traditional_resource_n4.json::max_ilp_n=4",The small-function exact slice has a harder SSHR-I sanity check than the broad n<=6 timed extension.,"Even this slice is a counterpoint under the paper's logical resource projection, not a proof of global reversible optimality."
SSHR tradeoff in resource-weight sensitivity,pass,covered,The resource-weight audit explicitly keeps SSHR-H and SSHR-I CNOT-only losses visible while showing paper-score and T-score advantages.,files_missing=none; tokens=5/5; missing_tokens=none; json=results/manifest_resource_weight_sensitivity_audit.json::needs_revision_count=0,The proposed method improves T-count and weighted resource profiles against SSHR while preserving the CNOT-only counterexample.,Weighted-score wins cannot be rewritten as all-metric or CNOT-only SSHR dominance.
Comparison and claim-boundary integration,pass,covered,"Comparison answer, target-validity, threats-to-validity, and claim-scope gates all mark SSHR as a CNOT counterpoint rather than the whole comparison target.",files_missing=none; tokens=4/4; missing_tokens=none; json=results/manifest_claim_scope_lint.json::unresolved_count=0,The manuscript's SSHR comparison is meaningful and bounded by explicit claim-scope checks.,"No paper-facing text may claim full SSHR replacement, universal optimality, or hardware-mapped dominance."
Reviewer payload visibility,pass,covered,"The submission package exposes the comparison role, reviewer concern brief, and artifact guide so a reviewer can locate SSHR rows and their boundary quickly.",files_missing=none; tokens=4/4; missing_tokens=none,The uploaded artifact makes the SSHR comparison and its limited role findable without reading implementation history.,Support-package visibility does not add a new SSHR random-table rerun.
